{"schemaVersion":2,"contract":"wallet-accounting-list","requestId":"request-synthetic","asOf":"2026-10-14T08:00:00+00:00","items":[{"receiptId":"receipt-synthetic","walletId":"wallet-synthetic","instrumentId":"instrument-synthetic","recordedByUserId":"user-synthetic","knownAtUtc":"2026-10-14T08:00:00+00:00","publicationSequence":4,"historyDeclaration":{"attestationId":"history-synthetic","source":"userDeclaredPaperHistory","recordedByUserId":"user-synthetic","openingKnownFlat":true,"allManualFillsRecorded":true,"fromOccurredAtUtc":"2026-10-13T08:00:00+00:00","throughOccurredAtUtc":"2026-10-14T08:00:00+00:00"},"projection":{"policyVersion":"paper-wallet-fifo-receipt-v1","enginePolicyVersion":"wallet-fifo-projection-v2","receiptId":"wallet-fifo:cccccccccccccccccccccccccccccccccccccccccccccccccccccccccccccccc","inputHash":"cccccccccccccccccccccccccccccccccccccccccccccccccccccccccccccccc","scope":{"workspaceId":"workspace-synthetic","walletId":"wallet-synthetic","instrumentId":"instrument-synthetic","walletCurrency":"asset-usdt-synthetic"},"watermark":{"knownAtUtc":"2026-10-14T08:00:00+00:00","publicationSequence":3},"inputIds":["fill:fill-synthetic","history:history-synthetic","spec:spec-synthetic"],"historyComplete":true,"economicsSupported":true,"costsComplete":false,"grossRealizedPnl":"0","feesTotal":null,"otherCostsTotal":null,"netRealizedPnl":null,"issues":["unknown-or-unconverted-fees","unknown-or-unconverted-other-costs"],"lots":[{"lotId":"lot-synthetic","openingFillId":"fill-synthetic","specId":"spec-synthetic","positionSide":"net","direction":1,"originalQuantity":"0.01","remainingQuantity":"0.01","price":"100.25"}],"matches":[]}}],"nextCursor":null,"publicationWatermark":4,"snapshotCursor":"synthetic-accounting-snapshot"}
